更新時間,2025-08-19 09:05:00
交通資訊,開始時間,結束時間,內容
市高往西全線車多，請改道。,20250818162201,20250819162201,市高往西全線車多，請改道。
市高往西接忠孝橋引道事故，請改道。,20250818141844,20250819141844,市高往西接忠孝橋引道事故，請改道。
因應「2025大稻埕夏日節」每週三煙火活動，行經本市大同區大稻埕周邊公車配合調整措施,20250730170000,20250830170000,   臺北市公共運輸處表示，配合本府觀光傳播局辦理「2025大稻埕夏日節」煙火活動，每週三（8月6日、8月13日與8月20日每日19時至21時30分）綠17、紅33、9、12等27線市區公車路線及6線公路客運（8月6日、13日及20日每日18時至21時30分）配合活動交通管制期間改道行駛，並取消停靠本市大同區「大稻埕碼頭」（往南）、「延平宮」（往南）、「迪化街」（往西）等41個站位，請民眾於改道動線沿線站位候車。公運處同時呼籲民眾，可多利用鄰近的捷運車站搭乘捷運至目的地，並提前查詢公車行駛與預估到站時間，避免行程受影響。   臺北市聯營公車路線因交通管制改道而停用之站位，於「大臺北公車」網頁(ebus.gov.taipei)及智慧型站牌到站資訊將顯示「交管不停靠」，該資訊也同步提供APP業者介接發布，請民眾可善加利用。如對公車改道有任何疑問，可電洽站牌上各公車調度站詢問或透過臺北市民當家熱線1999（外縣市：02-27208889）了解相關訊息。
忠孝橋往三重事故，請改道,20250818153833,20250819153833,忠孝橋往三重事故，請改道
基高往南全線車多，請改道。,20250818172523,20250819172523,基高往南全線車多，請改道。
堤頂交流道南向壅塞，請改道。,20250818171414,20250819171414,堤頂交流道南向壅塞，請改道。
歡迎大家一起訓練「雙北AI公車站長」,20250811100000,20250911100000,　　為即時回應民眾搭乘公車問題，提升搭乘公車便利性，減輕公車駕駛長工作負擔，臺北市公車聯營管理委員會與新北市公共汽車客運商業同業公會將人工智慧(AI)引入公車服務，114年8月11日對外發布全國首創「雙北AI公車站長」-「站長阿明」，讓民眾可以口語化更直覺地詢問方式，快速獲取搭乘公車的相關資訊，讓搭乘公車變得更簡單；同時也減少乘客詢問駕駛長的機會，減輕駕駛長工作負擔，更專注於開車。目前「雙北AI公車站長」雖已初步開發，惟仍須持續訓練，讓回應內容可以更正確，歡迎大家一起前往體驗，與「站長阿明」互動問答，一起來幫他訓練。　　民眾搭乘公車時，可能會遇到不知道要搭乘哪一路線、是否在正確位置等車、是否有到哪一站、在哪一站下車、票價、付費方式、遺失物等常見問題，可能捨棄搭乘公車或於上車時詢問駕駛長，造成駕駛長額外工作負擔。為了能及時回應民眾搭公車的問題，臺北市政府交通局、新北市府交通局及臺北市公共運輸處，提出以AI技術建構虛擬公車站長的構想，指導臺北市公車聯營管理委員會及新北市公共汽車客運商業同業公會，開發「雙北AI公車站長」&ndash;「站長阿明」，將民眾經常詢問問題語意、公車路線、預估到站時間、停靠站位、其他公車問題等資訊，以生成式AI相關技術進行訓練，解析問題需求，並生成回應內容。民眾可以口語化的方式，直接詢問搭乘公車相關問題，在候車的當下及時獲得搭乘公車所需資訊，提升搭乘公車的便利性，不用上車再問駕駛長。目前「站長阿明」可提供中、英雙語語音交談，服務功能如下：1.公車路線規劃查詢2.預估到站時間查詢3.發車時刻資訊查詢4.路線停靠站位查詢5.其他公車問題查詢(遺失物協助、乘客服務資訊等)　　「雙北AI公車站長」&ndash;「站長阿明」，將以「實體機台」與「QR-Code」2種方式與大家見面，地點於臺北市「市府轉運站」(實體機台+ QR-Code)及「臺北車站(鄭州)」(往東)(QR-Code)；新北市「板橋公車站」(實體機台+QR-Code)及「捷運淡水站」(QR-Code)亮相，快閃活動時間為114年8月11日至8月17日每日下午3時至6時。民眾可與「實體機台」內的「站長阿明」進行互動問答，或掃描「QR-Code」詢問(QR-Code僅限於活動地點使用)。另外，目前「站長阿明」雖已初步開發，惟仍須持續訓練，讓回應內容可以更正確，歡迎大家一起前往體驗，與「站長阿明」互動問答，一起來幫他訓練吧。　　另外提醒，「站長阿明」不會要求您於手機介面中進行以下操作，請安心使用並避免受騙。1.提供您的個人資料、銀行帳號或密碼2.加入不明的LINE或社群帳號3.掃描其他可疑QR-Code或跳轉外部不明網站
