更新時間,2025-08-01 09:35:00
交通資訊,開始時間,結束時間,內容
市高往西全線車多，請改道。,20250731170128,20250801170128,市高往西全線車多，請改道。
因應「2025大稻埕夏日節」每週三煙火活動，行經本市大同區大稻埕周邊公車配合調整措施,20250730170000,20250830170000,   臺北市公共運輸處表示，配合本府觀光傳播局辦理「2025大稻埕夏日節」煙火活動，每週三（8月6日、8月13日與8月20日每日19時至21時30分）綠17、紅33、9、12等27線市區公車路線及6線公路客運（8月6日、13日及20日每日18時至21時30分）配合活動交通管制期間改道行駛，並取消停靠本市大同區「大稻埕碼頭」（往南）、「延平宮」（往南）、「迪化街」（往西）等41個站位，請民眾於改道動線沿線站位候車。公運處同時呼籲民眾，可多利用鄰近的捷運車站搭乘捷運至目的地，並提前查詢公車行駛與預估到站時間，避免行程受影響。   臺北市聯營公車路線因交通管制改道而停用之站位，於「大臺北公車」網頁(ebus.gov.taipei)及智慧型站牌到站資訊將顯示「交管不停靠」，該資訊也同步提供APP業者介接發布，請民眾可善加利用。如對公車改道有任何疑問，可電洽站牌上各公車調度站詢問或透過臺北市民當家熱線1999（外縣市：02-27208889）了解相關訊息。
自強隧道往故宮方向壅塞，請改道。,20250731185118,20250801185118,自強隧道往故宮方向壅塞，請改道。
忠孝西路往西，中華路前事故，請改道。,20250731192958,20250801192958,忠孝西路往西，中華路前事故，請改道。
基高往南全線車多，請改道。,20250731172617,20250801172617,基高往南全線車多，請改道。
臺北市電動公車完成電池系統擴大特檢,20250704121000,20250804121000,　　臺北市電動公車實施高、低壓電池組及車端充電座等3大電系項目逐車特檢，已在今(7月4日)完成，目前無異常情形。　　臺北市262路電動公車114年6月16日晚間發生火燒車事故，公車業者翌日完成電池系統及場站充電樁檢查，並就事故同型車113輛(不含事故車)於6月23日完成高、低壓電池組與車端充電座等3大電系項目逐車特檢。日前，北市將特檢範圍擴及全市電動公車，已在今日(7月4日)完成，除262路線所屬19輛電動公車尚待復派程序外，其餘均正常營運。　　公運處說明，落實車輛保養及定期檢查是實踐安全管理的基礎，將持續督導公車業者依原廠標準實踐車輛保養、確實執行異常通報並強化緊急應變機制，進而提升公共運輸安全水準，保障市民乘車安全。-以下空白-
臺北捷運北投機廠電動公車共享充電場域正式啟用,20250702100500,20250802100500,　　臺北市長蔣萬安今日（2日）出席捷運北投機廠電動公車場域啟用活動。這項計畫由是透過交通局、公運處檢討公車業者的充電調度需求、北捷公司盤整機廠內可利用土地與電力資源，並由大南汽車公司負責整體設施建置，在捷運北投機廠內設置11個充電柱、22個充電席位，後續由大南汽車管理並開放所有公車業者共享充電。　　蔣萬安市長表示，市府積極推動綠色運輸及市區公車全面電動化，全市電動公車將於今年突破千輛；這次計畫是將充電場域設置於捷運機廠內部，利用捷運主要在日間用電、電動公車主要在夜間充電的特性，相互媒合讓土地及電力資源發揮最大效益，是城市智慧管理的具體展現。　　北市公運處說明，為提升充電場域安全，北捷公司及大南汽車在場站規劃有移動式細水霧設備及鋰電池專用滅火器等高規格先進消防安全設備。公運處補充，即日起服務士林地區往返重慶北路、南京東路及市府周邊的288路線，共21輛公車也同步換新為電動公車，全市電動公車達886輛，突破1/4，提供市民更安靜、舒適的乘車體驗。　　臺北市希望透過這個成功案例，成為後續共享場站的典範，後續將持續輔導業者將屆期柴油車汰換為電動公車、建置充電場站，以提供加便利、更友善的公共運輸服務，向119年市區公車全面電動化邁進！-以下空白-
